{
  "projectAcronym": "ARGENTIC",
  "totalMonths": 36,
  "projectStartDate": "tbd",
  "reportingPeriods": [
    {
      "id": "RP1",
      "monthFrom": 1,
      "monthTo": 18
    },
    {
      "id": "RP2",
      "monthFrom": 19,
      "monthTo": 36
    }
  ],
  "workPackages": [
    {
      "id": "WP1",
      "name": "Project Coordination",
      "lead": "MAG",
      "monthFrom": 1,
      "monthTo": 36,
      "milestoneIds": [
        "MS1",
        "MS2"
      ],
      "tasks": [
        {
          "id": "T1.1",
          "name": "Project management",
          "phases": [
            {
              "monthFrom": 1,
              "monthTo": 36
            }
          ]
        },
        {
          "id": "T1.2",
          "name": "Technical and scientific coordination",
          "phases": [
            {
              "monthFrom": 1,
              "monthTo": 36
            }
          ]
        },
        {
          "id": "T1.3",
          "name": "Data management, risk management and quality assurance",
          "phases": [
            {
              "monthFrom": 1,
              "monthTo": 36
            }
          ]
        },
        {
          "id": "T1.4",
          "name": "Social impact, ethical and legal compliance",
          "phases": [
            {
              "monthFrom": 1,
              "monthTo": 36
            }
          ]
        }
      ]
    },
    {
      "id": "WP2",
      "name": "Agentic and sovereign architecture for the cognitive continuum",
      "lead": "NVCR",
      "monthFrom": 1,
      "monthTo": 12,
      "milestoneIds": [
        "MS4"
      ],
      "tasks": [
        {
          "id": "T2.1",
          "name": "Use case-driven requirements and cognitive continuum scenarios",
          "phases": [
            {
              "monthFrom": 1,
              "monthTo": 12
            }
          ]
        },
        {
          "id": "T2.2",
          "name": "Reference architecture for distributed agentic intelligence",
          "phases": [
            {
              "monthFrom": 1,
              "monthTo": 12
            }
          ]
        },
        {
          "id": "T2.3",
          "name": "Compliance blueprint for sovereignty, privacy and energy constraints",
          "phases": [
            {
              "monthFrom": 1,
              "monthTo": 12
            }
          ]
        },
        {
          "id": "T2.4",
          "name": "Federated interoperability and agentic collaboration protocols",
          "phases": [
            {
              "monthFrom": 3,
              "monthTo": 12
            }
          ]
        },
        {
          "id": "T2.5",
          "name": "Digital Twin integration layer",
          "phases": [
            {
              "monthFrom": 3,
              "monthTo": 12
            }
          ]
        }
      ]
    },
    {
      "id": "WP3",
      "name": "Distributed agentic intelligence for Edge-Cloud-HPC systems",
      "lead": "UTU",
      "monthFrom": 4,
      "monthTo": 30,
      "milestoneIds": [
        "MS5"
      ],
      "tasks": [
        {
          "id": "T3.1",
          "name": "Lightweight Language Model integration for edge agents",
          "phases": [
            {
              "monthFrom": 4,
              "monthTo": 30
            }
          ]
        },
        {
          "id": "T3.2",
          "name": "Agent lifecycle, goal resolution and auto-evolution mechanisms",
          "phases": [
            {
              "monthFrom": 4,
              "monthTo": 30
            }
          ]
        },
        {
          "id": "T3.3",
          "name": "Multi-agent collaboration and dynamic task delegation",
          "phases": [
            {
              "monthFrom": 4,
              "monthTo": 30
            }
          ]
        },
        {
          "id": "T3.4",
          "name": "Agentic intent-handling and self-optimisation",
          "phases": [
            {
              "monthFrom": 4,
              "monthTo": 30
            }
          ]
        },
        {
          "id": "T3.5",
          "name": "Hardware-Software Co-design for Sovereign Agents",
          "phases": [
            {
              "monthFrom": 4,
              "monthTo": 30
            }
          ]
        }
      ]
    },
    {
      "id": "WP4",
      "name": "Federated knowledge and contextual data infrastructure",
      "lead": "UOULU",
      "monthFrom": 4,
      "monthTo": 30,
      "milestoneIds": [],
      "tasks": [
        {
          "id": "T4.1",
          "name": "Local Knowledge Graphs and memory embeddings per agent",
          "phases": [
            {
              "monthFrom": 4,
              "monthTo": 30
            }
          ]
        },
        {
          "id": "T4.2",
          "name": "Federated knowledge orchestration and role-based access",
          "phases": [
            {
              "monthFrom": 4,
              "monthTo": 30
            }
          ]
        },
        {
          "id": "T4.3",
          "name": "Next-generation retrieval-augmented generation (RAG 2.0) interfaces for secure contextual retrieval and external data fusion",
          "phases": [
            {
              "monthFrom": 4,
              "monthTo": 30
            }
          ]
        },
        {
          "id": "T4.4",
          "name": "Federated ontology alignment and privacy contracts",
          "phases": [
            {
              "monthFrom": 4,
              "monthTo": 30
            }
          ]
        }
      ]
    },
    {
      "id": "WP5",
      "name": "Agentic orchestration and human-governed autonomy",
      "lead": "SQD",
      "monthFrom": 6,
      "monthTo": 33,
      "milestoneIds": [
        "MS5"
      ],
      "tasks": [
        {
          "id": "T5.1",
          "name": "AI-orchestrated task placement for the cognitive continuum",
          "phases": [
            {
              "monthFrom": 6,
              "monthTo": 33
            }
          ]
        },
        {
          "id": "T5.2",
          "name": "Human-in-the-loop control points and decision escalation",
          "phases": [
            {
              "monthFrom": 6,
              "monthTo": 33
            }
          ]
        },
        {
          "id": "T5.3",
          "name": "Explainability, auditing and policy-aligned agent behaviour logging",
          "phases": [
            {
              "monthFrom": 6,
              "monthTo": 33
            }
          ]
        },
        {
          "id": "T5.4",
          "name": "Agentic-aware scheduling and EcoMode governance",
          "phases": [
            {
              "monthFrom": 6,
              "monthTo": 33
            }
          ]
        }
      ]
    },
    {
      "id": "WP6",
      "name": "Sustainable agent lifecycle, RLHF, and evaluation pipelines",
      "lead": "UM",
      "monthFrom": 13,
      "monthTo": 33,
      "milestoneIds": [
        "MS8",
        "MS9"
      ],
      "tasks": [
        {
          "id": "T6.1",
          "name": "Continuous integration and secure model lifecycle automation",
          "phases": [
            {
              "monthFrom": 13,
              "monthTo": 28
            }
          ]
        },
        {
          "id": "T6.2",
          "name": "Reinforcement learning from Human Feedback (RLHF) integration",
          "phases": [
            {
              "monthFrom": 13,
              "monthTo": 28
            }
          ]
        },
        {
          "id": "T6.3",
          "name": "Evaluation framework for robustness, efficiency and bias auditing",
          "phases": [
            {
              "monthFrom": 13,
              "monthTo": 33
            }
          ]
        },
        {
          "id": "T6.4",
          "name": "Energy-aware fine-tuning and model switching",
          "phases": [
            {
              "monthFrom": 13,
              "monthTo": 33
            }
          ]
        },
        {
          "id": "T6.5",
          "name": "Provenance and compliance verification pipeline",
          "phases": [
            {
              "monthFrom": 13,
              "monthTo": 33
            }
          ]
        }
      ]
    },
    {
      "id": "WP7",
      "name": "Continuum-scale deployment and pilot validation",
      "lead": "MAG",
      "monthFrom": 13,
      "monthTo": 36,
      "milestoneIds": [
        "MS7",
        "MS8",
        "MS10"
      ],
      "tasks": [
        {
          "id": "T7.1",
          "name": "Pilot case strategy, preparation and planning",
          "phases": [
            {
              "monthFrom": 13,
              "monthTo": 18
            }
          ]
        },
        {
          "id": "T7.2",
          "name": "UC1 - Bedside agentic AI monitoring for proactive hospital care",
          "phases": [
            {
              "monthFrom": 19,
              "monthTo": 33
            }
          ]
        },
        {
          "id": "T7.3",
          "name": "UC2 - Mangrovia IoT",
          "phases": [
            {
              "monthFrom": 19,
              "monthTo": 33
            }
          ]
        },
        {
          "id": "T7.4",
          "name": "UC3 - Digital marketing optimization",
          "phases": [
            {
              "monthFrom": 19,
              "monthTo": 33
            }
          ]
        },
        {
          "id": "T7.5",
          "name": "UC4 - Immersive AR/VR cultural heritage personalized guide",
          "phases": [
            {
              "monthFrom": 19,
              "monthTo": 33
            }
          ]
        },
        {
          "id": "T7.6",
          "name": "UC5 - AI-driven strawberry breeding and cultivation optimisation",
          "phases": [
            {
              "monthFrom": 19,
              "monthTo": 33
            }
          ]
        },
        {
          "id": "T7.7",